{
  "$schema": "http://json-schema.org/draft-07/schema#",
  "$id": "player_backtest.schema.json",
  "title": "Player-level walk-forward evaluation (scripts/backtest_player.py)",
  "description": "Walk-forward, held-out player-level evaluation of the DEPLOYED projection path (scripts.models.player_projection.project_player, whose from_week=1 total is the RoS number app/ros.js renders), scored per position against two baselines. Honesty is enforced structurally: `engine` is pinned by enum so the artifact cannot claim a different code path, `__meta__.approximations` cannot be emptied, and `__meta__.path_identity` carries the MEASURED split-then-sum round trip rather than a claim about it. Deliberately NO $ref anywhere: scripts/validate_data.py implements a draft-07 subset that silently skips $ref subschemas, so a $ref here would be an unvalidated hole.",
  "type": "object",
  "additionalProperties": false,
  "required": ["__meta__", "per_season", "pooled", "summary", "signal_audit"],
  "properties": {
    "__meta__": {
      "type": "object",
      "additionalProperties": false,
      "required": [
        "generated_utc", "method", "granularity", "engine", "engine_path",
        "substrate", "eval_seasons", "min_games", "baselines",
        "weights_source", "nonzero_weights", "schedule_source",
        "path_identity", "approximations"
      ],
      "properties": {
        "generated_utc": { "type": "string" },
        "method": { "type": "string", "enum": ["walk_forward_season_holdout"] },
        "granularity": { "type": "string", "enum": ["season"] },
        "engine": {
          "type": "string",
          "enum": ["scripts.models.player_projection.project_player"]
        },
        "engine_path": { "type": "string" },
        "baseline_rule_scored": { "type": "string", "description": "R49 - the baseline rule the engine used for the scored proj_points (the SHIPPED rule)." },
        "substrate": { "type": "string" },
        "eval_seasons": {
          "type": "array",
          "minItems": 1,
          "items": { "type": "integer", "minimum": 1999 }
        },
        "min_games": { "type": "integer", "minimum": 1 },
        "baselines": {
          "type": "array",
          "minItems": 2,
          "items": { "type": "string" }
        },
        "weights_source": { "type": "string", "enum": ["registry", "override"] },
        "nonzero_weights": {
          "type": "object",
          "additionalProperties": { "type": "number" }
        },
        "schedule_source": { "type": "string" },
        "path_identity": {
          "type": "object",
          "additionalProperties": false,
          "required": ["checked", "max_abs_diff", "tolerance", "holds", "note"],
          "properties": {
            "checked": { "type": "integer", "minimum": 0 },
            "max_abs_diff": { "type": ["number", "null"], "minimum": 0 },
            "tolerance": { "type": "number", "minimum": 0 },
            "holds": { "type": "boolean" },
            "note": { "type": "string" }
          }
        },
        "approximations": {
          "type": "array",
          "minItems": 3,
          "items": { "type": "string" }
        }
      }
    },
    "per_season": {
      "type": "array",
      "minItems": 1,
      "items": {
        "type": "object",
        "additionalProperties": false,
        "required": ["season", "held_out", "fit_seasons",
                     "excluded_no_prior_season", "positions"],
        "properties": {
          "season": { "type": "integer" },
          "held_out": { "type": "integer" },
          "fit_seasons": { "type": "string" },
          "excluded_no_prior_season": { "type": "integer", "minimum": 0 },
          "positions": {
            "type": "object",
            "additionalProperties": {
              "type": "object",
              "additionalProperties": false,
              "required": ["n", "measured"],
              "properties": {
                "n": { "type": "integer", "minimum": 0 },
                "measured": { "type": "boolean" },
                "skipped": { "type": "string" },
                "rho_engine": { "type": ["number", "null"], "minimum": -1, "maximum": 1 },
                "rho_last_year": { "type": ["number", "null"], "minimum": -1, "maximum": 1 },
                "rho_ppg17": { "type": ["number", "null"], "minimum": -1, "maximum": 1 },
                "ndcg_engine": { "type": ["number", "null"], "minimum": 0, "maximum": 1 },
                "ndcg_last_year": { "type": ["number", "null"], "minimum": 0, "maximum": 1 },
                "ndcg_ppg17": { "type": ["number", "null"], "minimum": 0, "maximum": 1 },
                "mae_engine": { "type": ["number", "null"], "minimum": 0 },
                "mae_last_year": { "type": ["number", "null"], "minimum": 0 },
                "mae_ppg17": { "type": ["number", "null"], "minimum": 0 },
                "rmse_engine": { "type": ["number", "null"], "minimum": 0 },
                "rmse_last_year": { "type": ["number", "null"], "minimum": 0 },
                "rmse_ppg17": { "type": ["number", "null"], "minimum": 0 },
                "beats_last_year": { "type": "boolean" },
                "beats_ppg17": { "type": "boolean" },
                "engine_equals_last_year": { "type": "boolean" },
                "rho_gated": { "type": ["number", "null"], "minimum": -1, "maximum": 1 },
                "mae_gated": { "type": ["number", "null"], "minimum": 0 },
                "delta_vs_last_year": { "type": "number" },
                "delta_vs_ppg17": { "type": "number" }
              }
            }
          }
        }
      }
    },
    "pooled": {
      "type": "object",
      "additionalProperties": {
        "type": "object",
        "additionalProperties": false,
        "required": ["n", "measured"],
        "properties": {
          "n": { "type": "integer", "minimum": 0 },
          "measured": { "type": "boolean" },
          "skipped": { "type": "string" },
          "rho_engine": { "type": ["number", "null"], "minimum": -1, "maximum": 1 },
          "rho_last_year": { "type": ["number", "null"], "minimum": -1, "maximum": 1 },
          "rho_ppg17": { "type": ["number", "null"], "minimum": -1, "maximum": 1 },
          "ndcg_engine": { "type": ["number", "null"], "minimum": 0, "maximum": 1 },
          "ndcg_last_year": { "type": ["number", "null"], "minimum": 0, "maximum": 1 },
          "ndcg_ppg17": { "type": ["number", "null"], "minimum": 0, "maximum": 1 },
          "mae_engine": { "type": ["number", "null"], "minimum": 0 },
          "mae_last_year": { "type": ["number", "null"], "minimum": 0 },
          "mae_ppg17": { "type": ["number", "null"], "minimum": 0 },
          "rmse_engine": { "type": ["number", "null"], "minimum": 0 },
          "rmse_last_year": { "type": ["number", "null"], "minimum": 0 },
          "rmse_ppg17": { "type": ["number", "null"], "minimum": 0 },
          "beats_last_year": { "type": "boolean" },
          "beats_ppg17": { "type": "boolean" },
          "engine_equals_last_year": { "type": "boolean" },
          "rho_gated": { "type": ["number", "null"], "minimum": -1, "maximum": 1 },
          "mae_gated": { "type": ["number", "null"], "minimum": 0 },
          "delta_vs_last_year": { "type": "number" },
          "delta_vs_ppg17": { "type": "number" }
        }
      }
    },
    "summary": {
      "type": "object",
      "additionalProperties": false,
      "required": ["positions_scored", "engine_beats_last_year",
                   "engine_beats_ppg17", "player_seasons_scored",
                   "player_seasons_excluded_no_prior",
                   "engine_equals_last_year_everywhere"],
      "properties": {
        "positions_scored": { "type": "integer", "minimum": 0 },
        "engine_beats_last_year": { "type": "integer", "minimum": 0 },
        "engine_beats_ppg17": { "type": "integer", "minimum": 0 },
        "player_seasons_scored": { "type": "integer", "minimum": 0 },
        "player_seasons_excluded_no_prior": { "type": "integer", "minimum": 0 },
        "engine_equals_last_year_everywhere": { "type": "boolean" }
      }
    },
    "baseline_gate": {
      "type": "object",
      "description": "R49 - the never-regress verdict on the games-normalized baseline (prior_ppg x 17, no absence known historically) versus the shipped total rule, pooled over positions (n-weighted). adopted_for_shipped is true ONLY when the rule beats the incumbent on BOTH pooled MAE and pooled rank-corr.",
      "additionalProperties": false,
      "required": ["shipped_rule", "candidate_rule", "adopted_for_shipped", "reason",
                   "pooled_rho_total_rule", "pooled_rho_ppg_rule",
                   "pooled_mae_total_rule", "pooled_mae_ppg_rule", "per_position"],
      "properties": {
        "candidate_vs_gated": {
          "type": "object",
          "description": "R49 owner override - the walk-forward comparison that matters once shipped == candidate: candidate_points vs gated_points through project_player, pooled n-weighted over positions.",
          "additionalProperties": false,
          "required": ["shipped_estimate", "owner_override", "pooled_rho_gated", "pooled_rho_candidate", "pooled_mae_gated", "pooled_mae_candidate", "per_position", "note"],
          "properties": {
            "shipped_estimate": { "type": "string", "enum": ["gated", "candidate"] },
            "owner_override": { "type": "boolean" },
            "pooled_rho_gated": { "type": ["number", "null"] },
            "pooled_rho_candidate": { "type": ["number", "null"] },
            "pooled_mae_gated": { "type": ["number", "null"] },
            "pooled_mae_candidate": { "type": ["number", "null"] },
            "per_position": {
              "type": "object",
              "additionalProperties": {
                "type": "object",
                "additionalProperties": false,
                "required": ["n", "rho_gated", "rho_candidate", "mae_gated", "mae_candidate"],
                "properties": {
                  "n": { "type": "integer", "minimum": 0 },
                  "rho_gated": { "type": ["number", "null"] },
                  "rho_candidate": { "type": ["number", "null"] },
                  "mae_gated": { "type": ["number", "null"] },
                  "mae_candidate": { "type": ["number", "null"] }
                }
              }
            },
            "note": { "type": "string" }
          }
        },
        "shipped_rule": { "type": "string" },
        "candidate_rule": { "type": "string" },
        "adopted_for_shipped": { "type": "boolean" },
        "reason": { "type": "string" },
        "pooled_rho_total_rule": { "type": ["number", "null"] },
        "pooled_rho_ppg_rule": { "type": ["number", "null"] },
        "pooled_mae_total_rule": { "type": ["number", "null"] },
        "pooled_mae_ppg_rule": { "type": ["number", "null"] },
        "per_position": {
          "type": "object",
          "additionalProperties": {
            "type": "object",
            "additionalProperties": false,
            "required": ["n", "rho_total_rule", "rho_ppg_rule", "mae_total_rule", "mae_ppg_rule"],
            "properties": {
              "n": { "type": "integer", "minimum": 0 },
              "rho_total_rule": { "type": ["number", "null"] },
              "rho_ppg_rule": { "type": ["number", "null"] },
              "mae_total_rule": { "type": ["number", "null"] },
              "mae_ppg_rule": { "type": ["number", "null"] }
            }
          }
        }
      }
    },
    "candidate_2025": {
      "type": "object",
      "description": "R49 - last year's projected vs actual through the CANDIDATE machinery: 2024 priors -> 2025 actuals (season granularity, players with >= min_games in 2025 and a 2024 line). baseline = prior_ppg x 17 with no signal; candidate = baseline x every signal the historical substrate can feed at full strength; shipped = the total rule. Signals the substrate cannot feed are NAMED, not assumed neutral. sleeper_* is a DISPLAY-ONLY reference (Sleeper's own 2025 weekly projections summed), never an input.",
      "additionalProperties": false,
      "required": ["season", "players", "baseline_mae", "candidate_mae", "shipped_mae",
                   "band_coverage", "signals_evaluated", "signals_not_evaluable",
                   "by_position", "sleeper_mae", "sleeper_players", "sleeper_note"],
      "properties": {
        "season": { "type": "integer", "minimum": 2020 },
        "players": { "type": "integer", "minimum": 0 },
        "shipped_estimate": { "type": "string", "enum": ["gated", "candidate"] },
        "baseline_mae": { "type": ["number", "null"], "minimum": 0 },
        "candidate_mae": { "type": ["number", "null"], "minimum": 0 },
        "shipped_mae": { "type": ["number", "null"], "minimum": 0 },
        "gated_mae": { "type": ["number", "null"], "minimum": 0 },
        "baseline_rho": { "type": ["number", "null"] },
        "candidate_rho": { "type": ["number", "null"] },
        "shipped_rho": { "type": ["number", "null"] },
        "gated_rho": { "type": ["number", "null"] },
        "band_coverage": { "type": ["number", "null"], "minimum": 0, "maximum": 1 },
        "band_multiplier": { "type": "number", "minimum": 0, "description": "The calibrated multiplier on the raw band (player_projection.CANDIDATE_BAND_MULTIPLIER); band_coverage is measured AT this multiplier." },
        "band_target": { "type": "number", "minimum": 0, "maximum": 1 },
        "band_rule": { "type": "string" },
        "signals_evaluated": { "type": "array", "items": { "type": "string" } },
        "signals_not_evaluable": { "type": "array", "items": { "type": "string" } },
        "by_position": {
          "type": "object",
          "additionalProperties": {
            "type": "object",
            "additionalProperties": false,
            "required": ["n", "baseline_mae", "candidate_mae", "shipped_mae", "band_coverage"],
            "properties": {
              "n": { "type": "integer", "minimum": 0 },
              "baseline_mae": { "type": ["number", "null"], "minimum": 0 },
              "candidate_mae": { "type": ["number", "null"], "minimum": 0 },
              "shipped_mae": { "type": ["number", "null"], "minimum": 0 },
              "gated_mae": { "type": ["number", "null"], "minimum": 0 },
              "band_coverage": { "type": ["number", "null"], "minimum": 0, "maximum": 1 },
              "sleeper_mae": { "type": ["number", "null"], "minimum": 0 },
              "sleeper_n": { "type": ["integer", "null"], "minimum": 0 }
            }
          }
        },
        "sleeper_mae": { "type": ["number", "null"], "minimum": 0 },
        "sleeper_players": { "type": ["integer", "null"], "minimum": 0 },
        "sleeper_note": { "type": "string" }
      }
    },
    "signal_audit": {
      "type": "object",
      "additionalProperties": false,
      "required": ["player_signals_in_registry", "baseline_fed",
                   "engine_implements", "deployed_inputs_fire",
                   "candidate_inputs_fire", "substrate_missing",
                   "registry_only", "note"],
      "properties": {
        "player_signals_in_registry": { "type": "integer", "minimum": 0 },
        "baseline_fed": { "type": "array", "items": { "type": "string" } },
        "engine_implements": { "type": "array", "items": { "type": "string" } },
        "deployed_inputs_fire": { "type": "array", "items": { "type": "string" } },
        "candidate_inputs_fire": { "type": "array", "items": { "type": "string" } },
        "substrate_missing": { "type": "array", "items": { "type": "string" } },
        "registry_only": { "type": "array", "items": { "type": "string" } },
        "note": { "type": "string" }
      }
    }
  }
}
