{
  "__meta__": {
    "generated_utc": "2026-10-27T22:07:01Z",
    "method": "walk_forward_season_holdout",
    "granularity": "season",
    "engine": "scripts.models.player_projection.project_player",
    "engine_path": "espn_players.build_player_records -> project_player -> build_weekly.player_weeks -> app/ros.js rosPoints(from_week=1)",
    "baseline_rule_scored": "prior_season_points",
    "substrate": "data/player_history.json (season totals 2021-2025)",
    "eval_seasons": [
      2022,
      2023,
      2024,
      2025
    ],
    "min_games": 6,
    "baselines": [
      "last_year (prior-season point total)",
      "ppg17 (retired backtest_ros formula: games-weighted 2-season ppg * 17 + damped trajectory slope)"
    ],
    "weights_source": "registry",
    "nonzero_weights": {},
    "schedule_source": "data/schedule_full.json",
    "path_identity": {
      "checked": 680,
      "max_abs_diff": 0.1,
      "tolerance": 0.15,
      "holds": true,
      "note": "build_weekly.player_weeks() split then app/ros.js rosPoints() sum, measured against project_player()'s season projection; difference is week-level 2dp + sum-level 1dp rounding only"
    },
    "approximations": [
      "WEEKLY SHAPE IS NOT GRADED HERE: only the from_week=1 RoS total is scored. Start/sit accuracy and the weekly split's factors are graded by scripts/backtest_weekly.py (R51) on data/fixtures/backtest_weekly/.",
      "AVAILABILITY REDUCTION IS NOT GRADED: build_weekly mechanic (b) needs the historical week's injury report, which is not committed; every backtested player is projected fully available.",
      "REDUCED INPUT SET: the substrate has no age, injury status, O-line or target-competition history, so those engine inputs are absent. At day-zero weights applied = 1 + 0*(adj-1) = 1, so this provably cannot change proj_points; under non-zero weights it would, and the run warns on stderr."
    ]
  },
  "per_season": [
    {
      "season": 2022,
      "held_out": 2022,
      "fit_seasons": "<= 2021",
      "excluded_no_prior_season": 44,
      "positions": {
        "QB": {
          "n": 26,
          "measured": true,
          "rho_engine": 0.4749,
          "ndcg_engine": 0.8593,
          "mae_engine": 86.236,
          "rmse_engine": 101.59,
          "rho_last_year": 0.4236,
          "ndcg_last_year": 0.8503,
          "mae_last_year": 89.338,
          "rmse_last_year": 108.852,
          "rho_ppg17": 0.4851,
          "ndcg_ppg17": 0.8756,
          "mae_ppg17": 85.396,
          "rmse_ppg17": 102.49,
          "beats_last_year": true,
          "beats_ppg17": false,
          "engine_equals_last_year": false,
          "rho_gated": 0.4236,
          "mae_gated": 89.338
        },
        "RB": {
          "n": 18,
          "measured": true,
          "rho_engine": 0.4572,
          "ndcg_engine": 0.874,
          "mae_engine": 71.029,
          "rmse_engine": 87.7,
          "rho_last_year": 0.2095,
          "ndcg_last_year": 0.8491,
          "mae_last_year": 79.173,
          "rmse_last_year": 102.403,
          "rho_ppg17": 0.5542,
          "ndcg_ppg17": 0.9268,
          "mae_ppg17": 76.1,
          "rmse_ppg17": 88.013,
          "beats_last_year": true,
          "beats_ppg17": false,
          "engine_equals_last_year": false,
          "rho_gated": 0.2095,
          "mae_gated": 79.173
        },
        "WR": {
          "n": 40,
          "measured": true,
          "rho_engine": 0.709,
          "ndcg_engine": 0.9065,
          "mae_engine": 56.115,
          "rmse_engine": 74.194,
          "rho_last_year": 0.6985,
          "ndcg_last_year": 0.9178,
          "mae_last_year": 55.238,
          "rmse_last_year": 74.474,
          "rho_ppg17": 0.7062,
          "ndcg_ppg17": 0.9057,
          "mae_ppg17": 57.655,
          "rmse_ppg17": 75.606,
          "beats_last_year": true,
          "beats_ppg17": true,
          "engine_equals_last_year": false,
          "rho_gated": 0.6985,
          "mae_gated": 55.238
        },
        "TE": {
          "n": 25,
          "measured": true,
          "rho_engine": 0.6038,
          "ndcg_engine": 0.8483,
          "mae_engine": 45.275,
          "rmse_engine": 53.837,
          "rho_last_year": 0.5616,
          "ndcg_last_year": 0.8306,
          "mae_last_year": 44.772,
          "rmse_last_year": 54.262,
          "rho_ppg17": 0.6377,
          "ndcg_ppg17": 0.8588,
          "mae_ppg17": 46.451,
          "rmse_ppg17": 56.008,
          "beats_last_year": true,
          "beats_ppg17": false,
          "engine_equals_last_year": false,
          "rho_gated": 0.5616,
          "mae_gated": 44.772
        }
      }
    },
    {
      "season": 2023,
      "held_out": 2023,
      "fit_seasons": "<= 2022",
      "excluded_no_prior_season": 47,
      "positions": {
        "QB": {
          "n": 25,
          "measured": true,
          "rho_engine": 0.4115,
          "ndcg_engine": 0.8399,
          "mae_engine": 93.972,
          "rmse_engine": 119.371,
          "rho_last_year": 0.3685,
          "ndcg_last_year": 0.8085,
          "mae_last_year": 100.233,
          "rmse_last_year": 125.941,
          "rho_ppg17": 0.2823,
          "ndcg_ppg17": 0.8071,
          "mae_ppg17": 109.522,
          "rmse_ppg17": 134.235,
          "beats_last_year": true,
          "beats_ppg17": true,
          "engine_equals_last_year": false,
          "rho_gated": 0.3685,
          "mae_gated": 100.233
        },
        "RB": {
          "n": 32,
          "measured": true,
          "rho_engine": 0.3303,
          "ndcg_engine": 0.8597,
          "mae_engine": 65.703,
          "rmse_engine": 84.848,
          "rho_last_year": 0.3136,
          "ndcg_last_year": 0.9058,
          "mae_last_year": 71.206,
          "rmse_last_year": 93.856,
          "rho_ppg17": 0.4113,
          "ndcg_ppg17": 0.917,
          "mae_ppg17": 68.105,
          "rmse_ppg17": 87.379,
          "beats_last_year": true,
          "beats_ppg17": false,
          "engine_equals_last_year": false,
          "rho_gated": 0.3136,
          "mae_gated": 71.206
        },
        "WR": {
          "n": 57,
          "measured": true,
          "rho_engine": 0.8007,
          "ndcg_engine": 0.8673,
          "mae_engine": 48.745,
          "rmse_engine": 62.301,
          "rho_last_year": 0.7823,
          "ndcg_last_year": 0.8899,
          "mae_last_year": 48.56,
          "rmse_last_year": 60.423,
          "rho_ppg17": 0.7831,
          "ndcg_ppg17": 0.8822,
          "mae_ppg17": 52.339,
          "rmse_ppg17": 66.759,
          "beats_last_year": true,
          "beats_ppg17": true,
          "engine_equals_last_year": false,
          "rho_gated": 0.7823,
          "mae_gated": 48.56
        },
        "TE": {
          "n": 33,
          "measured": true,
          "rho_engine": 0.4883,
          "ndcg_engine": 0.8278,
          "mae_engine": 46.886,
          "rmse_engine": 58.74,
          "rho_last_year": 0.5084,
          "ndcg_last_year": 0.8985,
          "mae_last_year": 41.242,
          "rmse_last_year": 52.766,
          "rho_ppg17": 0.5007,
          "ndcg_ppg17": 0.8734,
          "mae_ppg17": 46.194,
          "rmse_ppg17": 58.28,
          "beats_last_year": false,
          "beats_ppg17": false,
          "engine_equals_last_year": false,
          "rho_gated": 0.5084,
          "mae_gated": 41.242
        }
      }
    },
    {
      "season": 2024,
      "held_out": 2024,
      "fit_seasons": "<= 2023",
      "excluded_no_prior_season": 42,
      "positions": {
        "QB": {
          "n": 28,
          "measured": true,
          "rho_engine": 0.5391,
          "ndcg_engine": 0.8241,
          "mae_engine": 77.644,
          "rmse_engine": 94.342,
          "rho_last_year": 0.5692,
          "ndcg_last_year": 0.8324,
          "mae_last_year": 77.016,
          "rmse_last_year": 104.209,
          "rho_ppg17": 0.4532,
          "ndcg_ppg17": 0.7961,
          "mae_ppg17": 86.225,
          "rmse_ppg17": 106.885,
          "beats_last_year": false,
          "beats_ppg17": true,
          "engine_equals_last_year": false,
          "rho_gated": 0.5692,
          "mae_gated": 77.016
        },
        "RB": {
          "n": 45,
          "measured": true,
          "rho_engine": 0.7205,
          "ndcg_engine": 0.9157,
          "mae_engine": 54.264,
          "rmse_engine": 68.148,
          "rho_last_year": 0.6085,
          "ndcg_last_year": 0.8307,
          "mae_last_year": 67.051,
          "rmse_last_year": 82.246,
          "rho_ppg17": 0.7212,
          "ndcg_ppg17": 0.8843,
          "mae_ppg17": 55.998,
          "rmse_ppg17": 69.025,
          "beats_last_year": true,
          "beats_ppg17": false,
          "engine_equals_last_year": false,
          "rho_gated": 0.6085,
          "mae_gated": 67.051
        },
        "WR": {
          "n": 76,
          "measured": true,
          "rho_engine": 0.6355,
          "ndcg_engine": 0.8741,
          "mae_engine": 57.998,
          "rmse_engine": 71.016,
          "rho_last_year": 0.654,
          "ndcg_last_year": 0.8591,
          "mae_last_year": 59.931,
          "rmse_last_year": 72.199,
          "rho_ppg17": 0.6431,
          "ndcg_ppg17": 0.87,
          "mae_ppg17": 60.956,
          "rmse_ppg17": 73.366,
          "beats_last_year": false,
          "beats_ppg17": false,
          "engine_equals_last_year": false,
          "rho_gated": 0.654,
          "mae_gated": 59.931
        },
        "TE": {
          "n": 41,
          "measured": true,
          "rho_engine": 0.6328,
          "ndcg_engine": 0.7847,
          "mae_engine": 44.656,
          "rmse_engine": 55.834,
          "rho_last_year": 0.5967,
          "ndcg_last_year": 0.7513,
          "mae_last_year": 45.407,
          "rmse_last_year": 57.963,
          "rho_ppg17": 0.5855,
          "ndcg_ppg17": 0.7757,
          "mae_ppg17": 47.611,
          "rmse_ppg17": 59.97,
          "beats_last_year": true,
          "beats_ppg17": true,